{
  "contract_version": 1,
  "run_id": "replace-with-run-id",
  "patch_sha256": "replace-with-patch-sha256",
  "task_sha256": "replace-with-task-sha256",
  "evidence_sha256": "replace-with-evidence-sha256",
  "decision": "accept",
  "criteria": [
    {
      "id": "ac1",
      "status": "pass",
      "evidence": "Reference a verifier command, diff location, or manual check."
    }
  ],
  "findings": []
}
